{
    "name": "Studysama",
    "nationalPokedexNumber": 2121,
    "baseStats": {
        "hp": 21,
        "attack": 21,
        "defence": 21,
        "special_attack": 21,
        "special_defence": 21,
        "speed": 21
    },
    "maleRatio": 0.0,
    "catchRate": 3,
    "baseScale": 0.6,
    "baseExperienceYield": 40,
    "baseFriendship": 0,
    "evYield": {
        "hp": 1
    },
    "experienceGroup": "slow",
    "hitbox": {
        "width": 0.75,
        "height": 1.1,
        "fixed": false
    },
    "primaryType": "ghost",
    "abilities": [
        "cursedbody",
        "h:cursedbody"
    ],
    "shoulderMountable": true,
    "moves": [
        "1:teleport",
        "6:confuseray",
        "24:nightshade",
        "24:shadowsneak",
        "36:hex",
        "tutor:poltergeist"
    ],
    "features": [],
    "behaviour": {
        "moving": {
            "walk": {
                "walkSpeed": "0.2"
            },
            "fly": {
                "canFly": true,
                "flySpeedHorizontal": "0.4"
            }
        },
        "herd": {
            "maxSize": 10,
            "toleratedLeaders": [
                {
                    "pokemon": "vedal",
                    "tier": 1,
                    "ignoresLevel": true
                }
            ]
        },
        "blockInteract": {
            "immuneToSweetBerryBushBlock": true,
            "canStandOnPowderSnow": true
        },
        "combat": {
            "willFlee": false
        }
    },
    "pokedex": [
        "cobblemon.species.studysama.desc"
    ],
    "drops": {
        "amount": "2",
        "entries": [
            {
                "item": "cobblemon:spell_tag",
                "percentage": 25
            },
            {
                "item": "cobblemon:payapa_berry",
                "percentage": 20
            },
            {
                "item": "minecraft:phantom_membrane",
                "quantityRange": "1-3"
            }
        ]
    },
    "eggGroups": ["undiscovered"],
    "dynamaxBlocked": false,
    "implemented": true,
    "height": 5,
    "weight": 5,
    "forms": [],
    "labels": [
        "custom",
        "neuroverse",
        "baby"
    ],
    "evolutions": [
        {
            "id": "studysama_neuroplushie",
            "variant": "level_up",
            "result": "neuroplushie",
            "consumeHeldItem": false,
            "learnableMoves": [
                "sistertherapy"
            ],
            "requirements": [
                {
                    "variant": "friendship",
                    "amount": 160
                },
                {
                    "variant": "party_member",
                    "target": "vedal"
                },
                {
                    "variant": "time_range",
                    "range": "day"
                }
            ]
        },
        {
            "id": "studysama_evilplushie",
            "variant": "level_up",
            "result": "evilplushie",
            "consumeHeldItem": false,
            "learnableMoves": [
                "sistertherapy"
            ],
            "requirements": [
                {
                    "variant": "friendship",
                    "amount": 160
                },
                {
                    "variant": "party_member",
                    "target": "vedal"
                },
                {
                    "variant": "time_range",
                    "range": "night"
                }
            ]
        }
    ],
    "lightingData": {
        "lightLevel": 5,
        "liquidGlowMode": "BOTH"
    }
}