{
    "name": "Vedal",
    "nationalPokedexNumber": 2126,
    "baseStats": {
        "hp": 120,
        "attack": 60,
        "defence": 100,
        "special_attack": 40,
        "special_defence": 100,
        "speed": 30
    },
    "maleRatio": 1.0,
    "catchRate": 45,
    "baseScale": 0.6,
    "baseExperienceYield": 160,
    "baseFriendship": 50,
    "evYield": {
        "hp": 2
    },
    "experienceGroup": "slow",
    "hitbox": {
        "width": 1,
        "height": 1.6,
        "fixed": false
    },
    "primaryType": "fighting",
    "abilities": [
        "shellarmor",
        "sturdy",
        "h:fatheroftheyear"
    ],
    "shoulderMountable": true,
    "moves": [

    ],
    "features": [],
    "behaviour": {
        "resting": {
            "canSleep": true,
            "willSleepOnBed": true,
            "depth": "normal",
            "light": "0-4"
        },
        "moving": {
            "walk": {
                "walkSpeed": "0.2"
            }
        },
        "herd": {
            "maxSize": 5
        }
    },
    "pokedex": [
        "cobblemon.species.vedal.desc"
    ],
    "drops": {

    },
    "eggCycles": 45,
    "eggGroups": [
        "field"
    ],
    "dynamaxBlocked": false,
    "implemented": true,
    "height": 7,
    "weight": 907,
    "forms": [
        {
            "name": "Giga",
            "baseStats": {
                "hp": 120,
                "attack": 150,
                "defence": 110,
                "special_attack": 65,
                "special_defence": 110,
                "speed": 95
            },
            "baseScale": 1.0,
            "hitbox": {
                "width": 2,
                "height": 2,
                "fixed": false
            },
            "shoulderMountable": false,
            "height": 25,
            "weight": 3527,
            "battleOnly": true
        }
    ],
    "labels": [
        "custom",
        "neuroverse"
    ]
}