{
    "name": "Neuroplushie",
    "nationalPokedexNumber": 2122,
    "baseStats": {
        "hp": 70,
        "attack": 45,
        "defence": 60,
        "special_attack": 95,
        "special_defence": 75,
        "speed": 95
    },
    "maleRatio": 0.0,
    "catchRate": 3,
    "baseScale": 0.6,
    "baseExperienceYield": 140,
    "baseFriendship": 0,
    "evYield": {
        "special_attack": 2
    },
    "experienceGroup": "slow",
    "hitbox": {
        "width": 1,
        "height": 1,
        "fixed": false
    },
    "primaryType": "fairy",
    "abilities": [
        "unaware",
        "h:unaware"
    ],
    "shoulderMountable": true,
    "moves": [
        "1:round",
        "1:confusion",
        "1:playnice",
        "1:conversion",
        "5:sing",
        "10:flatter",
        "12:babydolleyes",
        "18:drainingkiss",
        "21:memento",
        "25:playrough",
        "28:conversion2",
        "32:encore",
        "36:roleplay",
        "42:hypervoice",
        "50:nastyplot",
        "56:alluringvoice",
        "60:moonblast",
        "65:healingwish",
        "85:perishsong",
        "tm:pounce",
        "tm:thief",
        "tm:spite",
        "tm:overheat",
        "tm:teleport",
        "tm:confuseray",
        "tm:nightshade",
        "tm:shadowsneak",
        "tm:taunt",
        "tm:alluringvoice",
        "tm:charm",
        "tm:safeguard",
        "tm:protect",
        "tm:scaryface",
        "tm:zenheadbutt",
        "tm:rest",
        "tm:sleeptalk",
        "tm:dazzlinggleam",
        "tm:imprison",
        "tm:psychic",
        "tm:substitute",
        "tm:mistyexplosion",
        "tm:selfdestruct",
        "tm:psychup",
        "tm:mistyterrain",
        "tm:shadowball",
        "tm:lightscreen",
        "tm:reflect",
        "tm:foulplay",
        "tm:psyshock",
        "tm:thunderwave",
        "tm:thunderbolt",
        "tm:trick",
        "tm:terablast",
        "tm:facade",
        "tm:eerieimpulse",
        "tm:helpinghand",
        "tm:wish",
        "tm:trickroom",
        "tm:psychicnoise",
        "tm:darkpulse",
        "tm:metronome",
        "tm:endure",
        "tm:steelbeam",
        "tm:flashcannon",
        "tm:metalsound",
        "tm:raindance",
        "tm:sunnyday",
        "tm:fling",
        "special:hex",
        "special:poltergeist",
        "special:sistertherapy",
        "special:restart"
    ],
    "features": [],
    "behaviour": {
        "resting": {
            "canSleep": true,
            "willSleepOnBed": true,
            "light": "0-4"
        },
        "moving": {
            "walk": {
                "walkSpeed": "0.2"
            },
            "fly": {
                "canFly": true,
                "flySpeedHorizontal": "1.0"
            }
        },
        "dampensVibrations": true,
        "combat": {
            "willFlee": false
        },
        "herd": {
            "maxSize": 10,
            "toleratedLeaders": [
                {
                    "pokemon": "vedal",
                    "tier": 1,
                    "ignoresLevel": true
                }
            ]
        }
    },
    "pokedex": [
        "cobblemon.species.neuroplushie.desc"
    ],
    "drops": {
        "amount": "2",
        "entries": [
            {
                "item": "cobblemon:babiri_berry",
                "percentage": 30.0
            },
            {
                "item": "neuromon:heart_transmitter",
                "percentage": 5.0
            }
        ]
    },
    "eggGroups": ["undiscovered"],
    "dynamaxBlocked": false,
    "implemented": true,
    "height": 9,
    "weight": 10,
    "forms": [],
    "labels": [
        "custom",
        "neuroverse"
    ],
    "evolutions": [
        {
            "id": "neuroplushie_neurosama",
            "variant": "level_up",
            "result": "neurosama",
            "consumeHeldItem": false,
            "learnableMoves": [
                "restart"
            ],
            "requirements": [
                {
                    "variant": "use_move_while_holding",
                    "heldItem": "neuromon:heart_transmitter",
                    "move": "alluringvoice",
                    "amount": 50
                }
            ]
        }
    ],
    "preEvolution": "studysama"
}