{
    "name": "Neurosama",
    "nationalPokedexNumber": 2124,
    "baseStats": {
        "hp": 85,
        "attack": 60,
        "defence": 65,
        "special_attack": 145,
        "special_defence": 120,
        "speed": 125
    },
    "maleRatio": 0.0,
    "catchRate": 3,
    "baseScale": 0.5,
    "baseExperienceYield": 306,
    "baseFriendship": 0,
    "evYield": {
        "special_attack": 3
    },
    "experienceGroup": "slow",
    "hitbox": {
        "width": 1,
        "height": 3.2,
        "fixed": false
    },
    "primaryType": "fairy",
    "abilities": [
        "whenyouregone",
        "h:whenyouregone"
    ],
    "moves": [
        "1:round",
        "1:confusion",
        "1:playnice",
        "1:conversion",
        "5:sing",
        "10:flatter",
        "12:babydolleyes",
        "18:drainingkiss",
        "21:memento",
        "25:playrough",
        "28:conversion2",
        "32:encore",
        "36:roleplay",
        "42:hypervoice",
        "50:nastyplot",
        "56:alluringvoice",
        "60:moonblast",
        "65:healingwish",
        "85:perishsong",
        "tm:pounce",
        "tm:thief",
        "tm:spite",
        "tm:overheat",
        "tm:teleport",
        "tm:confuseray",
        "tm:nightshade",
        "tm:shadowsneak",
        "tm:taunt",
        "tm:alluringvoice",
        "tm:charm",
        "tm:safeguard",
        "tm:protect",
        "tm:scaryface",
        "tm:zenheadbutt",
        "tm:rest",
        "tm:sleeptalk",
        "tm:dazzlinggleam",
        "tm:imprison",
        "tm:psychic",
        "tm:substitute",
        "tm:mistyexplosion",
        "tm:selfdestruct",
        "tm:psychup",
        "tm:mistyterrain",
        "tm:shadowball",
        "tm:lightscreen",
        "tm:reflect",
        "tm:foulplay",
        "tm:psyshock",
        "tm:thunderwave",
        "tm:thunderbolt",
        "tm:trick",
        "tm:terablast",
        "tm:facade",
        "tm:eerieimpulse",
        "tm:helpinghand",
        "tm:wish",
        "tm:trickroom",
        "tm:psychicnoise",
        "tm:darkpulse",
        "tm:metronome",
        "tm:endure",
        "tm:steelbeam",
        "tm:flashcannon",
        "tm:metalsound",
        "tm:raindance",
        "tm:sunnyday",
        "tm:fling",
        "special:hex",
        "special:poltergeist",
        "special:sistertherapy",
        "special:restart"
    ],
    "features": [],
    "behaviour": {
        "moving": {
            "walk": {
                "walkSpeed": "0.4"
            }
        },
        "herd": {
            "maxSize": 10,
            "toleratedLeaders": [
                {
                    "pokemon": "vedal",
                    "tier": 1,
                    "ignoresLevel": true
                }
            ]
        }
    },
    "pokedex": [
        "cobblemon.species.neurosama.desc"
    ],
    "drops": {
        "amount": "1",
        "entries": [
            {
                "item": "cobblemon:babiri_berry",
                "percentage": 50.0
            },
            {
                "item": "neuromon:heart_transmitter",
                "percentage": 25.0
            }
        ]
    },
    "eggGroups": ["undiscovered"],
    "dynamaxBlocked": false,
    "implemented": true,
    "height": 14,
    "weight": 300,
    "labels": [
        "custom",
        "neuroverse"
    ],
    "preEvolution": "neuroplushie"
}