{
    "name": "Evilneuro",
    "nationalPokedexNumber": 2125,
    "baseStats": {
        "hp": 100,
        "attack": 135,
        "defence": 120,
        "special_attack": 70,
        "special_defence": 100,
        "speed": 75
    },
    "maleRatio": 0.0,
    "catchRate": 3,
    "baseScale": 0.5,
    "baseExperienceYield": 306,
    "baseFriendship": 0,
    "evYield": {
        "attack": 3
    },
    "experienceGroup": "slow",
    "hitbox": {
        "width": 1,
        "height": 3.2,
        "fixed": false
    },
    "primaryType": "dark",
    "abilities": [
        "abberdemon",
        "h:abberdemon"
    ],
    "moves": [
        "1:scratch",
        "1:flatter",
        "1:swagger",
        "1:leer",
        "5:brutalswing",
        "10:knockoff",
        "12:snarl",
        "18:meanlook",
        "21:frustration",
        "25:alluringvoice",
        "28:faketears",
        "32:torment",
        "36:screech",
        "42:beatup",
        "50:stompingtantrum",
        "56:outrage",
        "60:foulplay",
        "65:spiritbreak",
        "85:bulkup",
        "tm:teleport",
        "tm:confuseray",
        "tm:nightshade",
        "tm:shadowsneak",
        "tm:thief",
        "tm:takedown",
        "tm:protect",
        "tm:metronome",
        "tm:rest",
        "tm:sleeptalk",
        "tm:bodyslam",
        "tm:bodypress",
        "tm:taunt",
        "tm:substitute",
        "tm:focusblast",
        "tm:voltswitch",
        "tm:nastyplot",
        "tm:throatchop",
        "tm:playrough",
        "tm:lashout",
        "tm:disarmingvoice",
        "tm:sing",
        "tm:boomburst",
        "tm:psychicnoise",
        "tm:brickbreak",
        "tm:firepunch",
        "tm:thunderpunch",
        "tm:icepunch",
        "tm:fling",
        "tm:trick",
        "tm:imprison",
        "tm:shadowclaw",
        "tm:reflect",
        "tm:lightscreen",
        "tm:trailblaze",
        "tm:willowisp",
        "tm:darkpulse",
        "tm:burningjealousy",
        "tm:metalsound",
        "tm:irondefense",
        "tm:nightslash",
        "tm:guillotine",
        "tm:stoneedge",
        "tm:ironhead",
        "tm:stealthrock",
        "tm:falseswipe",
        "tm:xscissor",
        "tm:closecombat",
        "tm:terablast",
        "special:hex",
        "special:poltergeist",
        "special:sistertherapy",
        "special:liquidation",
        "special:woodhammer",
        "special:meteormash",
        "special:supercellslam"
    ],
    "features": [],
    "behaviour": {
        "moving": {
            "walk": {
                "walkSpeed": "0.4"
            }
        },
        "herd": {
            "maxSize": 10,
            "toleratedLeaders": [
                {
                    "pokemon": "vedal",
                    "tier": 1,
                    "ignoresLevel": true
                }
            ]
        }
    },
    "pokedex": [
        "cobblemon.species.evilneuro.desc"
    ],
    "drops": {
        "amount": "1",
        "entries": [
            {
                "item": "cobblemon:chople_berry",
                "percentage": 50.0
            },
            {
                "item": "neuromon:baleful_harpoon",
                "percentage": 25.0
            }
        ]
    },
    "eggGroups": ["undiscovered"],
    "dynamaxBlocked": false,
    "implemented": true,
    "height": 14,
    "weight": 300,
    "forms": [],
    "labels": [
        "custom",
        "neuroverse"
    ],
    "preEvolution": "evilplushie"
}