{
    "name": "Staz",
    "nationalPokedexNumber": 2128,
    "baseStats": {
        "hp": 80,
        "attack": 30,
        "defence": 60,
        "special_attack": 30,
        "special_defence": 75,
        "speed": 180
    },
    "maleRatio": 1.0,
    "catchRate": 45,
    "baseScale": 0.8,
    "baseExperienceYield": 100,
    "baseFriendship": 70,
    "evYield": {
        "speed": 2
    },
    "experienceGroup": "medium_slow",
    "hitbox": {
        "width": 1,
        "height": 2,
        "fixed": false
    },
    "primaryType": "psychic",
    "abilities": [
        "trace",
        "keeneye",
        "h:shadowtag"
    ],
    "moves": [
        "1:teleport",
        "1:mirrorcoat",
        "1:counter",
        "1:foresight",
        "5:imprison",
        "7:detect",
        "10:skillswap",
        "12:trick",
        "16:encore",
        "20:confusion",
        "24:safeguard",
        "26:rest",
        "26:sleeptalk",
        "32:amnesia",
        "35:destinybond",
        "40:psychicterrain",
        "50:reflect",
        "50:lightscreen",
        "tm:painsplit",
        "tm:trickroom",
        "tm:rest",
        "tm:sleeptalk",
        "tm:reflect",
        "tm:lightscreen",
        "tm:taunt",
        "tm:metronome",
        "tm:charm",
        "tm:confuseray",
        "tm:disable",
        "tm:embargo",
        "tm:fairylock",
        "tm:flatter",
        "tm:swagger",
        "tm:followme",
        "tm:gravity",
        "tm:hypnosis",
        "tm:mistyterrain",
        "tm:psychup",
        "tm:recycle",
        "tm:raindance",
        "tm:sunnyday",
        "tm:spotlight"
    ],
    "features": [],
    "behaviour": {
        "herd": {
            "maxSize": 10,
            "toleratedLeaders": [
                {
                    "pokemon": "vedal",
                    "tier": 1,
                    "ignoresLevel": true
                }
            ]
        }
    },
    "pokedex": [
        "cobblemon.species.staz.desc"
    ],
    "drops": {
        "amount": "1",
        "entries": [
            {
                "item": "cobblemon:black_glasses",
                "percentage": 10.0
            }
        ]
    },
    "eggCycles": 20,
    "eggGroups": [
        "field",
        "human_like"
    ],
    "dynamaxBlocked": false,
    "implemented": true,
    "height": 15,
    "weight": 400,
    "labels": [
        "custom",
        "neuroverse"
    ]
}