{
    "name": "Gymbag",
    "nationalPokedexNumber": 2127,
    "baseStats": {
        "hp": 60,
        "attack": 95,
        "defence": 75,
        "special_attack": 50,
        "special_defence": 65,
        "speed": 85
    },
    "maleRatio": 0.5,
    "catchRate": 75,
    "baseScale": 0.75,
    "baseExperienceYield": 150,
    "baseFriendship": 50,
    "evYield": {
        "attack": 1
    },
    "experienceGroup": "medium_fast",
    "hitbox": {
        "width": 0.9,
        "height": 1.9,
        "fixed": false
    },
    "primaryType": "steel",
    "secondaryType": "flying",
    "abilities": [
        "tintedlens",
        "klutz",
        "h:infiltrator"
    ],
    "moves": [
        "1:odorsleuth",
        "1:tackle",
        "4:swagger",
        "5:headbutt",
        "6:gust",
        "10:doublehit",
        "12:recycle",
        "16:encore",
        "20:metalsound",
        "24:knockoff",
        "26:ironhead",
        "32:batonpass",
        "34:lockon",
        "35:reflect",
        "36:thunderwave",
        "40:selfdestruct",
        "44:whirlwind",
        "50:gunkshot",
        "55:shiftgear",
        "egg:switcheroo",
        "egg:autotomize",
        "egg:refresh",
        "egg:tickle",
        "egg:copycat",
        "tm:lightscreen",
        "tm:protect",
        "tm:rest",
        "tm:sleeptalk",
        "tm:thunder",
        "tm:thunderbolt",
        "tm:trickroom",
        "tm:substitute",
        "tm:irondefense",
        "tm:lastresort",
        "tm:endure",
        "tm:facade",
        "tm:signalbeam",
        "tm:defog",
        "tm:voltswitch",
        "tm:magnetbomb",
        "tm:rapidspin",
        "tm:uproar",
        "tm:fly",
        "tm:aerialace",
        "tm:playrough",
        "tm:detect",
        "tm:willowisp",
        "tm:confuseray",
        "tm:metronome",
        "tm:flash",
        "tm:spikes",
        "tm:poisonjab",
        "tutor:toxic",
        "tutor:mistyexplosion",
        "tutor:playrough",
        "tutor:toxicspikes",
        "tutor:gravity"
    ],
    "features": [],
    "behaviour": {
        "resting": {
            "canSleep": true,
            "willSleepOnBed": true,
            "depth": "normal",
            "light": "0-4"
        },
        "moving": {
            "fly": {
                "canFly": true
            },
            "walk": {
                "canWalk": false
            },
            "wanderChance": 60
        },
        "herd": {
            "maxSize": 10,
            "followDistance": "2-4",
            "toleratedLeaders": [
                {
                    "pokemon": "gymbag shiny=false",
                    "tier": 1
                },
                {
                    "pokemon": "gymbag shiny",
                    "tier": 2
                },
                {
                    "pokemon": "vedal",
                    "tier": 3,
                    "ignoresLevel": true
                },
                {
                    "pokemon": "studysama",
                    "tier": 4,
                    "ignoresLevel": true
                },
                {
                    "pokemon": "neuroplushie",
                    "tier": 5,
                    "ignoresLevel": true
                },
                {
                    "pokemon": "evilplushie",
                    "tier": 5,
                    "ignoresLevel": true
                },
                {
                    "pokemon": "neurosama",
                    "tier": 6,
                    "ignoresLevel": true
                },
                {
                    "pokemon": "evilneuro",
                    "tier": 6,
                    "ignoresLevel": true
                }
            ]
        }
    },
    "pokedex": [
        "cobblemon.species.gymbag.desc"
    ],
    "drops": {
        "amount": "1",
        "entries": [
            {
                "item": "minecraft:raw_iron",
                "quantityRange": "0-3"
            }
        ]
    },
    "eggCycles": 15,
    "eggGroups": [
        "bug"
    ],
    "dynamaxBlocked": false,
    "implemented": true,
    "height": 4,
    "weight": 12,
    "labels": [
        "custom",
        "neuroverse"
    ]
}